Symbol,Name,Last Sale,Net Change,% Change,Market Cap,Country,IPO Year,Volume,Sector,Industry
DBRG^I,DigitalBridge Group Inc. 7.15% Series I ,$24.00,-0.01,-0.042%,,United States,,19582,,
DBRG^J,DigitalBridge Group Inc. 7.125% Series J ,$24.18,0.08,0.332%,,United States,,12554,,
DBVT,DBV Technologies S.A. American Depositary Shares,$0.81,0.014,1.759%,156219467.00,France,2014,13200,Health Care,Biotechnology: Pharmaceutical Preparations
DBX,Dropbox Inc. Class A Common Stock,$24.46,-0.07,-0.285%,8413852505.00,United States,2018,4510591,Technology,Computer Software: Prepackaged Software
DC,Dakota Gold Corp. Common Stock,$2.15,0.08,3.865%,186491585.00,United States,2022,184256,Basic Materials,Precious Metals
DCBO,Docebo Inc. Common Shares,$51.45,0.91,1.801%,1631857040.00,Canada,,74125,Technology,Computer Software: Prepackaged Software
DCF,BNY Mellon Alcentra Global Credit Income 2024 Target Term Fund Inc. Common Stock,$8.57,-0.01,-0.117%,0.00,,2017,12510,Finance,Finance/Investors Services
DCFC,Tritium DCFC Limited Ordinary Shares,$0.072,0.003,4.348%,11522638.00,Australia,,1976422,Technology,Electronic Components
DCFCW,Tritium DCFC Limited Warrant,$0.028,0.0085,43.59%,4481026.00,Australia,,9867,Technology,Electronic Components
DCGO,DocGo Inc. Common Stock,$4.02,-0.07,-1.711%,418768903.00,United States,2020,1169883,Health Care,Managed Health Care
DCI,Donaldson Company Inc. Common Stock,$74.37,1.05,1.432%,8951851975.00,United States,,387829,Industrials,Pollution Control Equipment
DCO,Ducommun Incorporated Common Stock,$51.16,1.24,2.484%,749041439.00,United States,,72202,Industrials,Military/Government/Technical
DCOM,Dime Community Bancshares Inc. Common Stock,$18.97,1.04,5.80%,736547830.00,United States,,209812,Finance,Major Banks
DCOMP,Dime Community Bancshares Inc. Fixed-Rate Non-Cumulative Perpetual Preferred Stock Series A,$17.53,0.33,1.919%,680636977.00,United States,,9298,Finance,Major Banks
DCPH,Deciphera Pharmaceuticals Inc. Common Stock,$15.75,0.78,5.21%,1272600977.00,United States,2017,501177,Health Care,Biotechnology: Pharmaceutical Preparations
DCTH,Delcath Systems Inc. Common Stock,$4.25,-0.03,-0.701%,93695929.00,United States,,128665,Health Care,Medical/Dental Instruments
DD,DuPont de Nemours Inc. Common Stock,$74.51,0.79,1.072%,31114099197.00,United States,2017,1774172,Industrials,Major Chemicals
DDC,DDC Enterprise Limited Class A Ordinary Shares,$1.33,0.05,3.906%,26497680.00,,2023,27438,Basic Materials,Metal Mining
DDD,3D Systems Corporation Common Stock,$4.44,0.09,2.069%,592447178.00,United States,,1177761,Technology,Computer Software: Prepackaged Software
DDI,DoubleDown Interactive Co. Ltd. American Depository Shares,$12.855,-0.895,-6.509%,637009471.00,South Korea,2021,27609,Technology,EDP Services
DDL,Dingdong (Cayman) Limited American Depositary Shares (each two representing three Ordinary Shares),$1.22,0.00,0.00%,287948333.00,Cayman Islands,2021,189383,Consumer Discretionary,Catalog/Specialty Distribution
DDOG,Datadog Inc. Class A Common Stock,$123.44,1.63,1.338%,40966539768.00,United States,2019,2929623,Technology,EDP Services
DDS,Dillard's Inc. Common Stock,$439.66,3.64,0.835%,7132087140.00,United States,,65969,Consumer Discretionary,Department/Specialty Retail Stores
DDT,Dillard's Capital Trust I,$26.59,0.304,1.157%,431338300.00,United States,,5158,Consumer Discretionary,Department/Specialty Retail Stores
DE,Deere & Company Common Stock,$394.05,2.54,0.649%,109687052651.00,United States,,1763392,Industrials,Industrial Machinery/Components
DEA,Easterly Government Properties Inc. Common Stock,$11.34,0.29,2.624%,1160702321.00,United States,2015,958192,Real Estate,Real Estate Investment Trusts
DEC,Diversified Energy Company plc Ordinary Shares,$11.55,0.13,1.138%,556465544.00,,,234483,,
DECA,Denali Capital Acquisition Corp. Class A Ordinary Shares,$8.985,0.925,11.476%,0.00,United States,2022,100535,Finance,Blank Checks
DECAU,Denali Capital Acquisition Corp. Unit,$9.78,1.21,14.119%,0.00,United States,2022,100,Finance,Blank Checks
DECAW,Denali Capital Acquisition Corp. Warrant,$0.051,0.002,4.082%,0.00,United States,2022,18562,Finance,Blank Checks
DECK,Deckers Outdoor Corporation Common Stock,$915.18,6.32,0.695%,23491041580.00,United States,1993,341014,Consumer Discretionary,Shoe Manufacturing
DEI,Douglas Emmett Inc. Common Stock,$13.59,0.42,3.189%,2274312593.00,United States,2006,1621689,Real Estate,Real Estate Investment Trusts
DELL,Dell Technologies Inc. Class C Common Stock ,$111.07,3.55,3.302%,79037535399.00,United States,2018,9600219,Technology,Computer Manufacturing
DENN,Denny's Corporation Common Stock,$9.11,0.11,1.222%,476031380.00,United States,,340309,Consumer Discretionary,Restaurants
DEO,Diageo plc Common Stock,$146.33,0.54,0.37%,81721819127.00,United Kingdom,,514345,Consumer Staples,Beverages (Production/Distribution)
DERM,Journey Medical Corporation Common Stock,$3.84,0.05,1.319%,71072444.00,United States,2021,62094,Health Care,Biotechnology: Pharmaceutical Preparations
DESP,Despegar.com Corp. Ordinary Shares,$11.80,0.93,8.556%,779508000.00,Argentina,2017,1298068,Consumer Discretionary,Transportation Services
DFH,Dream Finders Homes Inc. Class A Common Stock,$38.75,2.92,8.15%,3614069978.00,United States,2022,417467,Consumer Discretionary,Homebuilding
DFIN,Donnelley Financial Solutions Inc. Common Stock ,$62.17,0.04,0.064%,1808540469.00,United States,2016,199257,Consumer Discretionary,Other Consumer Services
DFLI,Dragonfly Energy Holdings Corp. Common Stock (NV),$0.5175,0.0075,1.471%,30817545.00,United States,2021,232751,Technology,Electronic Components
DFLIW,Dragonfly Energy Holdings Corp. Warrant,$0.027,0.00,0.00%,1607872.00,United States,2021,1000,Technology,Electronic Components
DFP,Flaherty & Crumrine Dynamic Preferred and Income Fund Inc. Common Stock,$19.10,0.06,0.315%,0.00,,2013,94083,Finance,Investment Managers
DFS,Discover Financial Services Common Stock,$125.77,4.53,3.736%,31512339326.00,United States,,1006151,Finance,Finance: Consumer Services
DG,Dollar General Corporation Common Stock,$156.06,2.04,1.325%,34254741459.00,United States,2009,1958393,Consumer Discretionary,Department/Specialty Retail Stores
DGHI,Digihost Technology Inc. Common Subordinate Voting Shares,$1.49,0.06,4.196%,43701922.00,Canada,,87662,Finance,Finance: Consumer Services
DGICA,Donegal Group Inc. Class A Common Stock,$13.93,-0.11,-0.783%,465170466.00,United States,,71812,Finance,Property-Casualty Insurers
DGICB,Donegal Group Inc. Class B Common Stock,$13.11,0.00,0.00%,437787854.00,United States,1986,224,Finance,Property-Casualty Insurers
DGII,Digi International Inc. Common Stock,$29.70,0.25,0.849%,1076821376.00,United States,1989,92902,Telecommunications,Computer Communications Equipment
DGLY,Digital Ally Inc. Common Stock,$2.65,-0.02,-0.749%,7421993.00,United States,,12822,Technology,Radio And Television Broadcasting And Communications Equipment
DGX,Quest Diagnostics Incorporated Common Stock,$127.72,-1.34,-1.038%,14139535462.00,United States,,586642,Health Care,Medical Specialities
DH,Definitive Healthcare Corp. Class A Common Stock,$8.02,0.17,2.166%,944138661.00,United States,2021,389220,Technology,Computer Software: Prepackaged Software
DHAC,Digital Health Acquisition Corp. Common Stock,$11.60,0.00,0.00%,41806006.00,United States,2021,1951,Health Care,Medical/Nursing Services
DHACW,Digital Health Acquisition Corp. Warrant,$0.17,-0.0233,-12.054%,612674.00,United States,2021,2700,Health Care,Medical/Nursing Services
DHAI,DIH Holdings US Inc. Class A Common Stock,$1.15,-0.0499,-4.159%,12604336.00,United States,2024,232699,,
DHAIW,DIH Holding US Inc. Warrants,$0.0213,-0.0042,-16.471%,233454.00,United States,2024,78443,Finance,Blank Checks
DHC,Diversified Healthcare Trust Common Shares of Beneficial Interest,$2.49,0.14,5.957%,598641724.00,United States,,1317238,Real Estate,Real Estate Investment Trusts
DHCNI,Diversified Healthcare Trust 5.625% Senior Notes due 2042,$15.25,0.04,0.263%,3666380036.00,United States,,13872,Real Estate,Real Estate Investment Trusts
DHCNL,Diversified Healthcare Trust 6.25% Senior Notes Due 2046,$16.14,0.04,0.248%,3880352379.00,United States,,9039,Real Estate,Real Estate Investment Trusts
DHF,BNY Mellon High Yield Strategies Fund Common Stock,$2.38,0.01,0.422%,0.00,United States,1998,764524,Finance,Finance Companies
DHI,D.R. Horton Inc. Common Stock,$158.58,2.49,1.595%,52619584580.00,United States,,1738785,Consumer Discretionary,Homebuilding
DHIL,Diamond Hill Investment Group Inc. Class A Common Stock,$151.84,1.05,0.696%,431769946.00,United States,,9998,Finance,Investment Managers
DHR,Danaher Corporation Common Stock,$251.68,-2.06,-0.812%,186168130148.00,United States,,1651287,Industrials,Industrial Machinery/Components
DHT,DHT Holdings Inc.,$10.93,-0.18,-1.62%,1777764500.00,Jersey,2005,2138411,Consumer Discretionary,Marine Transportation
DHX,DHI Group Inc. Common Stock,$2.57,0.10,4.049%,123443492.00,United States,2007,395471,Consumer Discretionary,Business Services
DHY,Credit Suisse High Yield Bond Fund Common Stock,$2.04,0.02,0.99%,0.00,United States,1998,207983,Finance,Finance/Investors Services
DIAX,Nuveen Dow 30SM Dynamic Overwrite Fund Common Shares of Beneficial Interest,$14.36,0.06,0.42%,0.00,,2014,131961,Finance,Finance Companies
DIBS,1stdibs.com Inc. Common Stock,$5.99,0.04,0.672%,238077408.00,United States,2021,151040,Consumer Discretionary,Catalog/Specialty Distribution
DIN,Dine Brands Global Inc. Common Stock,$46.92,0.54,1.164%,715668179.00,United States,,298212,Consumer Discretionary,Restaurants
DINO,HF Sinclair Corporation Common Stock,$61.49,1.83,3.067%,12209970793.00,United States,1960,2105268,Energy,Natural Gas Distribution
DIOD,Diodes Incorporated Common Stock,$66.25,1.61,2.491%,3043512015.00,United States,,263981,Technology,Semiconductors
DIS,Walt Disney Company (The) Common Stock,$116.46,1.95,1.703%,213622838288.00,United States,,11699645,Consumer Discretionary,Services-Misc. Amusement & Recreation
DIST,Distoken Acquisition Corporation Ordinary Shares,$10.66,0.00,0.00%,0.00,China,2023,2,Finance,Blank Checks
DIT,AMCON Distributing Company Common Stock,$192.00,2.30,1.212%,121029504.00,United States,1999,415,Consumer Discretionary,Food Distributors
DJCO,Daily Journal Corp. (S.C.) Common Stock,$368.88,8.23,2.282%,507957351.00,United States,,21855,Consumer Discretionary,Newspapers/Magazines
DK,Delek US Holdings Inc. Common Stock,$30.59,0.36,1.191%,1958349378.00,United States,2017,1101475,Energy,Integrated oil Companies
DKL,Delek Logistics Partners L.P. Common Units representing Limited Partner Interests,$41.35,0.59,1.447%,1803555135.00,United States,2012,165753,Energy,Natural Gas Distribution
DKNG,DraftKings Inc. Class A Common Stock,$46.27,2.49,5.688%,40099131073.00,United States,2019,16165888,Consumer Discretionary,Services-Misc. Amusement & Recreation
DKS,Dick's Sporting Goods Inc Common Stock,$219.31,4.35,2.024%,17927333003.00,United States,2002,1850241,Consumer Discretionary,Other Specialty Stores
DLA,Delta Apparel Inc. Common Stock,$3.21,0.23,7.718%,22634192.00,United States,2000,11422,Consumer Staples,Apparel
DLB,Dolby Laboratories Common Stock,$83.99,0.34,0.406%,8027666184.00,United States,2005,196009,Miscellaneous,Multi-Sector Companies
DLHC,DLH Holdings Corp.,$14.43,0.59,4.263%,205349116.00,United States,,21798,Consumer Discretionary,Professional Services
DLNG,Dynagas LNG Partners LP Common Units,$2.56,-0.16,-5.882%,94213752.00,Greece,,39026,Consumer Discretionary,Marine Transportation
DLNG^A,Dynagas LNG Partners LP 9.00% Series A Cumulative Redeemable Preferred Units,$25.35,0.0204,0.081%,,Greece,,1510,,
DLNG^B,Dynagas LNG Partners LP 8.75% Series B Fixed to Floating Rate Cumulative Redeemable Perpetual Preferred Units liquidation preference $25.00 per Uni,$26.35,0.165,0.63%,,Greece,,6976,,
DLO,DLocal Limited Class A Common Shares,$15.69,0.69,4.60%,4644109224.00,Uruguay,2021,1968170,Consumer Discretionary,Business Services
DLPN,Dolphin Entertainment Inc. Common Stock,$1.30,0.03,2.362%,23583747.00,United States,,9460,Consumer Discretionary,Other Consumer Services
DLR,Digital Realty Trust Inc. Common Stock,$140.89,-0.85,-0.60%,43999040091.00,United States,2004,2433310,Real Estate,Real Estate Investment Trusts
DLR^J,Digital Realty Trust Inc. 5.250% Series J Cumulative Redeemable Preferred Stock,$22.63,-0.19,-0.833%,,United States,,11831,,
DLR^K,Digital Realty Trust Inc. 5.850% Series K Cumulative Redeemable Preferred Stock par value $0.01 per share,$23.86,-0.14,-0.583%,,United States,,19891,,
DLR^L,Digital Realty Trust Inc. 5.200% Series L Cumulative Redeemable Preferred Stock,$22.45,-0.20,-0.883%,,United States,,18354,,
DLTH,Duluth Holdings Inc. Class B Common Stock,$4.99,0.12,2.464%,172031552.00,United States,2015,75243,Consumer Discretionary,Clothing/Shoe/Accessory Stores
DLTR,Dollar Tree Inc. Common Stock,$128.10,-0.09,-0.07%,27909395130.00,United States,1995,4213578,Consumer Discretionary,Department/Specialty Retail Stores
DLX,Deluxe Corporation Common Stock,$20.49,0.62,3.12%,898488057.00,United States,,243311,Consumer Discretionary,Advertising
DLY,DoubleLine Yield Opportunities Fund Common Shares of Beneficial Interest,$15.57,0.04,0.258%,746515779.00,United States,2020,102492,Finance,Investment Managers
DM,Desktop Metal Inc. Class A Common Stock,$0.7432,0.014,1.92%,244985856.00,United States,2019,2118075,Technology,Computer peripheral equipment
DMA,Destra Multi-Alternative Fund Common Stock,$7.39,-0.01,-0.135%,0.00,,2022,11881,Finance,Trusts Except Educational Religious and Charitable
DMAC,DiaMedica Therapeutics Inc. Common Stock,$2.77,-0.05,-1.773%,105143660.00,United States,2018,72359,Health Care,Biotechnology: Pharmaceutical Preparations
DMB,BNY Mellon Municipal Bond Infrastructure Fund Inc. Common Stock,$10.34,-0.01,-0.097%,0.00,,2013,31402,Finance,Trusts Except Educational Religious and Charitable
DMF,BNY Mellon Municipal Income Inc. Common Stock,$6.765,0.025,0.371%,421397627.00,United States,1988,47624,Finance,Finance/Investors Services
DMLP,Dorchester Minerals L.P. Common Units Representing Limited Partnership Interests,$33.55,0.05,0.149%,1328017803.00,United States,,68367,Energy,Oil & Gas Production
DMO,Western Asset Mortgage Opportunity Fund Inc. Common Stock,$11.55,-0.08,-0.688%,0.00,United States,2010,30280,Finance,Trusts Except Educational Religious and Charitable
DMRC,Digimarc Corporation Common Stock,$28.57,1.04,3.778%,584073538.00,United States,,200076,Technology,EDP Services
DMTK,DermTech Inc. Common Stock,$0.691,0.0039,0.568%,23924799.00,United States,2017,141766,Health Care,Medical Specialities
DNA,Ginkgo Bioworks Holdings Inc. Class A Common Stock,$1.15,0.06,5.505%,2475255154.00,United States,2021,15412848,Health Care,Biotechnology: Biological Products (No Diagnostic Substances)
DNB,Dun & Bradstreet Holdings Inc. Common Stock,$10.02,0.17,1.726%,4396736301.00,United States,2020,3829785,Finance,Finance: Consumer Services
DNLI,Denali Therapeutics Inc. Common Stock,$21.29,0.75,3.651%,2962721488.00,United States,2017,1043192,Health Care,Biotechnology: Biological Products (No Diagnostic Substances)
DNMR,Danimer Scientific Inc. Common Stock,$1.33,0.00,0.00%,135706905.00,United States,2020,664065,Industrials,Major Chemicals
DNN,Denison Mines Corp Ordinary Shares (Canada),$1.93,0.10,5.464%,1719622996.00,Canada,,13874451,,
DNOW,DNOW Inc. Common Stock,$14.63,0.24,1.668%,1553209984.00,United States,2014,1309927,Industrials,Metal Fabrications
DNP,DNP Select Income Fund Inc. Common Stock,$9.03,-0.01,-0.111%,0.00,United States,1987,666694,Finance,Investment Managers
DNTH,Dianthus Therapeutics Inc. Common Stock,$27.10,0.66,2.496%,401561350.00,United States,2018,99963,Health Care,Biotechnology: Pharmaceutical Preparations
DNUT,Krispy Kreme Inc. Common Stock,$12.01,0.26,2.213%,2026087000.00,United States,2021,637449,Consumer Staples,Food Chains
DO,Diamond Offshore Drilling Inc. Common Stock,$13.17,-0.07,-0.529%,1349491799.00,United States,2022,1670124,Energy,Oil & Gas Production
DOC,Healthpeak Properties Inc. Common Stock,$17.58,0.08,0.457%,9619301041.00,United States,,5071908,Real Estate,Real Estate Investment Trusts
DOCN,DigitalOcean Holdings Inc. Common Stock,$39.27,0.01,0.025%,3565586213.00,United States,2021,868046,Technology,Retail: Computer Software & Peripheral Equipment
DOCS,Doximity Inc. Class A Common Stock,$28.49,0.01,0.035%,5314916338.00,United States,2021,1242963,Technology,Retail: Computer Software & Peripheral Equipment
DOCU,DocuSign Inc. Common Stock,$58.54,-0.41,-0.696%,11938290155.00,United States,2018,2038960,Technology,EDP Services
DOGZ,Dogness (International) Corporation Class A Common Stock,$6.71,-0.34,-4.823%,71272030.00,China,2017,69253,Consumer Discretionary,Miscellaneous manufacturing industries
DOLE,Dole plc Ordinary Shares,$11.93,-0.03,-0.251%,1132157000.00,Ireland,2021,296888,Consumer Staples,Farming/Seeds/Milling
DOMA,Doma Holdings Inc. Common Stock,$4.45,0.04,0.907%,59793502.00,United States,2021,8247,Finance,Real Estate
DOMH,Dominari Holdings Inc. Common Stock,$2.31,-0.01,-0.431%,12347671.00,United States,,4295,Health Care,Biotechnology: Pharmaceutical Preparations
DOMO,Domo Inc. Class B Common Stock,$9.59,0.14,1.481%,351163724.00,United States,2018,203433,Technology,Computer Software: Prepackaged Software
DOOO,BRP Inc. (Recreational Products) Common Subordinate Voting Shares,$63.54,2.12,3.452%,4816752571.00,Canada,,91247,,
DOOR,Masonite International Corporation Ordinary Shares (Canada),$131.50,0.10,0.076%,2884117438.00,Canada,,509457,Basic Materials,Forest Products
DORM,Dorman Products Inc. Common Stock,$93.47,2.82,3.111%,2905631040.00,United States,,137518,Consumer Discretionary,Auto Parts:O.E.M.
DOUG,Douglas Elliman Inc. Common Stock,$1.73,0.08,4.848%,158356263.00,United States,2021,997150,Real Estate,Building operators
DOV,Dover Corporation Common Stock,$175.55,0.41,0.234%,24558860419.00,United States,,935827,Industrials,Industrial Machinery/Components
DOW,Dow Inc. Common Stock ,$58.17,1.41,2.484%,40852408998.00,United States,2019,7789651,Industrials,Major Chemicals
DOX,Amdocs Limited Ordinary Shares,$92.44,0.55,0.599%,10847632388.00,Guernsey,,847282,Technology,EDP Services
DOYU,DouYu International Holdings Limited ADS,$0.7615,0.0264,3.591%,243509919.00,China,2019,673039,Technology,Computer Software: Programming Data Processing
DPCS,DP Cap Acquisition Corp I Class A Ordinary Shares,$10.95,-0.02,-0.182%,0.00,United States,2021,521,Finance,Blank Checks
DPG,Duff & Phelps Utility and Infrastructure Fund Inc.,$9.23,-0.03,-0.324%,0.00,United States,2011,162167,Finance,Trusts Except Educational Religious and Charitable
DPRO,Draganfly Inc. Common Shares,$0.1745,-0.0024,-1.357%,8489467.00,Canada,,1699865,Industrials,Aerospace
DPSI,DecisionPoint Systems Inc. Common Stock,$9.05,0.35,4.023%,69275985.00,,2022,5691,Technology,Retail: Computer Software & Peripheral Equipment
DPZ,Domino's Pizza Inc Common Stock,$451.72,6.82,1.533%,15725603234.00,United States,2004,366013,Consumer Discretionary,Food Distributors
DQ,DAQO New Energy Corp. American Depositary Shares each representing five ordinary shares,$27.08,0.85,3.241%,2117782328.00,China,2010,1266188,Technology,Semiconductors
DRCT,Direct Digital Holdings Inc. Class A Common Stock,$31.79,4.59,16.875%,453656811.00,United States,2022,278220,Technology,Computer Software: Programming Data Processing
DRD,DRDGOLD Limited American Depositary Shares,$8.28,0.73,9.669%,715879452.00,South Africa,,580860,Basic Materials,Precious Metals
DRH,Diamondrock Hospitality Company Common Stock,$9.56,0.11,1.164%,2004036003.00,United States,2005,1525512,Real Estate,Real Estate Investment Trusts
DRH^A,Diamondrock Hospitality Company 8.250% Series A Cumulative Redeemable Preferred Stock,$26.11,-0.30,-1.136%,,United States,,74343,,
DRI,Darden Restaurants Inc. Common Stock,$174.58,0.49,0.281%,20846739734.00,United States,,1359272,Consumer Discretionary,Restaurants
DRIO,DarioHealth Corp. Common Stock,$1.40,-0.03,-2.098%,38100538.00,Israel,,70965,Health Care,Medical/Dental Instruments
DRMA,Dermata Therapeutics Inc. Common Stock,$0.40,0.0176,4.603%,1275614.00,United States,2021,118964,Health Care,Biotechnology: Pharmaceutical Preparations
DRQ,Dril-Quip Inc. Common Stock,$24.12,0.17,0.71%,830063413.00,United States,1997,255990,Industrials,Metal Fabrications
DRRX,DURECT Corporation Common Stock,$1.28,0.10,8.475%,38180980.00,United States,2000,91483,Health Care,Biotechnology: Pharmaceutical Preparations
DRS,Leonardo DRS Inc. Common Stock,$22.09,0.00,0.00%,5801494756.00,Israel,,636703,Industrials,Military/Government/Technical
DRTS,Alpha Tau Medical Ltd. Ordinary Shares,$3.04,0.09,3.051%,211798660.00,Israel,,52280,Health Care,Medical/Dental Instruments
DRTSW,Alpha Tau Medical Ltd. Warrant,$0.25,-0.0035,-1.381%,17417653.00,Israel,,2891,Health Care,Biotechnology: Pharmaceutical Preparations
DRUG,Bright Minds Biosciences Inc. Common Stock,$1.3027,0.0827,6.779%,5815040.00,Canada,,43403,Health Care,Biotechnology: Pharmaceutical Preparations
DRVN,Driven Brands Holdings Inc. Common Stock,$15.23,0.13,0.861%,2497287483.00,United States,2021,1399662,Consumer Discretionary,Automotive Aftermarket
DSGN,Design Therapeutics Inc. Common Stock,$2.90,0.31,11.969%,163833386.00,United States,2021,450776,Health Care,Biotechnology: Pharmaceutical Preparations
DSGR,Distribution Solutions Group Inc. Common Stock,$34.71,0.31,0.901%,1623849488.00,United States,,45871,Consumer Discretionary,Industrial Specialties
DSGX,Descartes Systems Group Inc. (The) Common Stock,$93.59,1.14,1.233%,7972319553.00,Canada,,107759,,
DSKE,Daseke Inc. Common Stock,$8.27,0.01,0.121%,390346340.00,United States,2015,937466,,
DSL,DoubleLine Income Solutions Fund Common Shares of Beneficial Interests,$12.70,0.06,0.475%,1295359716.00,United States,2013,289527,Finance,Trusts Except Educational Religious and Charitable
DSM,BNY Mellon Strategic Municipal Bond Fund Inc. Common Stock,$5.85,-0.05,-0.847%,0.00,United States,1989,57420,Finance,Investment Managers
DSP,Viant Technology Inc. Class A Common Stock,$10.08,0.08,0.80%,633314213.00,United States,2021,119313,Technology,EDP Services
DSS,DSS Inc. Common Stock,$1.87,0.01,0.538%,13114708.00,United States,,1962,Consumer Discretionary,Containers/Packaging
DSU,Blackrock Debt Strategies Fund Inc. Common Stock,$11.11,-0.04,-0.359%,0.00,United States,1998,129827,Finance,Finance Companies
DSWL,Deswell Industries Inc. Common Shares,$2.2183,0.0183,0.832%,35349141.00,Macau,1995,10742,Industrials,Plastic Products
DSX,Diana Shipping inc. common stock,$2.95,-0.01,-0.338%,459778180.00,Greece,2005,384366,Consumer Discretionary,Marine Transportation
DSX^B,Diana Shipping Inc. Perpetual Preferred Shares Series B (Marshall Islands),$26.88,0.24,0.901%,,Greece,,261,,
DT,Dynatrace Inc. Common Stock,$46.68,0.19,0.409%,13817244803.00,United States,2019,2287296,Technology,EDP Services
DTB,DTE Energy Company 2020 Series G 4.375% Junior Subordinated Debentures due 2080,$21.02,0.12,0.574%,4339641745.00,United States,2020,13256,Utilities,Electric Utilities: Central
DTC,Solo Brands Inc. Class A Common Stock,$2.25,0.09,4.167%,205145955.00,United States,2021,1040107,Consumer Discretionary,Recreational Games/Products/Toys
DTCK,Davis Commodities Limited Ordinary Shares,$1.11,-0.01,-0.893%,27014625.00,Singapore,2023,31749,Industrials,Farming/Seeds/Milling
DTE,DTE Energy Company Common Stock,$110.04,-0.41,-0.371%,22718086469.00,United States,,1770132,Utilities,Electric Utilities: Central
DTF,DTF Tax-Free Income 2028 Term Fund Inc. Common Stock,$10.75,-0.04,-0.371%,75567845.00,United States,1991,17505,Finance,Investment Managers
DTG,DTE Energy Company 2021 Series E 4.375% Junior Subordinated Debentures,$20.86,0.02,0.096%,4306609267.00,United States,2021,17481,Utilities,Electric Utilities: Central
DTI,Drilling Tools International Corporation Common Stock,$2.80,-0.04,-1.408%,83351990.00,United States,2021,4374,Industrials,Metal Fabrications
DTIL,Precision BioSciences Inc. Common Stock,$12.23,0.23,1.917%,49702243.00,United States,2019,102655,Health Care,Biotechnology: Biological Products (No Diagnostic Substances)
DTM,DT Midstream Inc. Common Stock ,$58.45,-0.23,-0.392%,5668455048.00,United States,2021,465537,Utilities,Oil & Gas Production
DTSS,Datasea Inc. Common Stock,$7.87,-0.22,-2.719%,19976311.00,China,,72319,Technology,Computer Software: Prepackaged Software
DTST,Data Storage Corporation Common Stock,$6.55,0.28,4.466%,44930557.00,United States,,185302,Technology,EDP Services
DTSTW,Data Storage Corporation Warrant,$1.02,0.16,18.605%,6996820.00,United States,,18111,Technology,EDP Services
DTW,DTE Energy Company 2017 Series E 5.25% Junior Subordinated Debentures due 2077,$24.90,0.10,0.403%,5140679327.00,United States,2017,45508,Utilities,Electric Utilities: Central
DUK,Duke Energy Corporation (Holding Company) Common Stock,$95.41,0.27,0.284%,73543120063.00,United States,,2682272,Industrials,Railroads
DUK^A,Duke Energy Corporation Depositary Shares each representing a 1/1000th interest in a share of 5.75% Series A Cumulative Redeemable Perpetual Preferred Stock,$25.37,0.01,0.039%,,United States,,41661,,
DUKB,Duke Energy Corporation 5.625% Junior Subordinated Debentures due 2078,$25.28,0.18,0.717%,19486113355.00,United States,2018,22127,Utilities,Power Generation
DUO,Fangdd Network Group Ltd. American Depositary Shares,$0.4831,-0.0019,-0.392%,1787208.00,China,2019,123174,Finance,Real Estate
DUOL,Duolingo Inc. Class A Common Stock,$234.00,6.82,3.002%,10032943752.00,United States,2021,621181,Technology,Computer Software: Prepackaged Software
DUOT,Duos Technologies Group Inc. Common Stock,$3.97,-0.02,-0.501%,28771110.00,United States,,12959,Technology,Computer Software: Prepackaged Software
DV,DoubleVerify Holdings Inc. Common Stock,$33.50,0.07,0.209%,5737005717.00,United States,2021,1914099,Technology,Computer Software: Prepackaged Software
