Symbol,Name,Last Sale,Net Change,% Change,Market Cap,Country,IPO Year,Volume,Sector,Industry
PRE^J,PartnerRe Ltd. 4.875% Fixed Rate Non-Cumulative Redeemable Preferred Shares Series J,$21.36,0.19,0.897%,,Bermuda,,13604,,
PRFT,Perficient Inc. Common Stock,$61.11,0.84,1.394%,2136430961.00,United States,1999,136085,Technology,EDP Services
PRFX,PainReform Ltd. Ordinary Shares,$1.92,0.0327,1.733%,3318426.00,Israel,2020,3064,Health Care,Biotechnology: Pharmaceutical Preparations
PRG,PROG Holdings Inc. Common Stock,$33.26,0.64,1.962%,1453086561.00,United States,,342105,Consumer Discretionary,Diversified Commercial Services
PRGO,Perrigo Company plc Ordinary Shares,$31.30,1.06,3.505%,4241648891.00,United States,,1395498,Health Care,Biotechnology: Pharmaceutical Preparations
PRGS,Progress Software Corporation Common Stock (DE),$52.98,-0.03,-0.057%,2324773314.00,United States,1991,321900,Technology,Computer Software: Prepackaged Software
PRH,Prudential Financial Inc. 5.950% Junior Subordinated Notes due 2062,$25.67,-0.20,-0.773%,9215530000.00,United States,2022,39167,Finance,Life Insurance
PRI,Primerica Inc. Common Stock,$251.83,1.53,0.611%,8775661538.00,United States,2010,109211,Finance,Life Insurance
PRIF^D,Priority Income Fund Inc. 7.00% Series D Term Preferred Stock due 2029,$22.8659,0.2059,0.909%,,,,500,,
PRIF^F,Priority Income Fund Inc. 6.625% Series F Term Preferred Stock due 2027,$23.10,0.10,0.435%,,,,550,,
PRIF^G,Priority Income Fund Inc. 6.25% Series G Preferred Stock Due 2026,$23.52,0.02,0.085%,,,,140,,
PRIF^H,Priority Income Fund Inc. 6.00% Series H Term Preferred Stock due 2026,$23.08,-0.0961,-0.415%,,,,1343,,
PRIF^I,Priority Income Fund Inc. 6.125% Series I Term Preferred Stock due 2028,$22.00,-0.33,-1.478%,,,,1649,,
PRIF^J,Priority Income Fund Inc. 6.000% Series J Term Preferred Stock due 2028,$22.50,-0.08,-0.354%,,,,973,,
PRIF^K,Priority Income Fund Inc. 7.000% Series K Cumulative Preferred Stock,$21.14,-0.11,-0.518%,,,,1769,,
PRIF^L,Priority Income Fund Inc. 6.375% Series L Term Preferred Stock Due 2029,$22.15,-0.07,-0.315%,,,,9606,,
PRIM,Primoris Services Corporation Common Stock,$40.86,0.96,2.406%,2183431080.00,United States,,733762,Industrials,Water Sewer Pipeline Comm & Power Line Construction
PRK,Park National Corporation Common Stock,$131.06,4.10,3.229%,2112225738.00,United States,1994,37921,Finance,Major Banks
PRKS,United Parks & Resorts Inc. Common Stock,$54.32,1.26,2.375%,3474854094.00,United States,2013,1245560,Health Care,Biotechnology: Electromedical & Electrotherapeutic Apparatus
PRLB,Proto Labs Inc. Common stock,$34.22,0.16,0.47%,880205369.00,United States,2012,90411,Industrials,Office Equipment/Supplies/Services
PRLD,Prelude Therapeutics Incorporated Common Stock,$4.84,0.00,0.00%,265815675.00,United States,2020,27161,Health Care, Medicinal Chemicals and Botanical Products 
PRLH,Pearl Holdings Acquisition Corp Class A Ordinary Shares,$10.80,0.0063,0.058%,0.00,United States,2022,1801,Finance,Blank Checks
PRM,Perimeter Solutions SA Ordinary Shares,$6.35,0.18,2.917%,925408925.00,Luxembourg,2021,542134,Consumer Discretionary,Newspapers/Magazines
PRME,Prime Medicine Inc. Common Stock,$7.37,0.26,3.657%,883952250.00,United States,2022,336754,Health Care, Medicinal Chemicals and Botanical Products 
PRMW,Primo Water Corporation Common Stock,$18.03,0.21,1.178%,2875983474.00,Canada,,1238530,Consumer Staples,Farming/Seeds/Milling
PRO,PROS Holdings Inc. Common Stock,$34.82,0.51,1.486%,1627411241.00,United States,2007,282261,Technology,EDP Services
PROC,Procaps Group S.A. Ordinary Shares,$3.105,-0.085,-2.665%,350319088.00,Luxembourg,,1521,Health Care,Biotechnology: Pharmaceutical Preparations
PROCW,Procaps Group S.A. Warrants,$0.0751,-0.0049,-6.125%,8473096.00,Luxembourg,,13936,Health Care,Biotechnology: Pharmaceutical Preparations
PROF,Profound Medical Corp. Common Stock,$8.37,0.11,1.332%,178831185.00,Canada,,8154,Health Care,Medical/Dental Instruments
PROK,ProKidney Corp. Class A Ordinary Shares,$1.46,0.09,6.569%,343734560.00,United States,2021,195473,Health Care,Biotechnology: Biological Products (No Diagnostic Substances)
PROP,Prairie Operating Co. Common Stock,$10.99,-0.74,-6.309%,,United States,,77486,Finance,Investment Bankers/Brokers/Service
PROV,Provident Financial Holdings Inc. Common Stock,$14.20,0.20,1.429%,98359083.00,United States,,3584,Finance,Savings Institutions
PRPH,ProPhase Labs Inc. Common Stock (DE),$5.53,0.30,5.736%,99789010.00,United States,,46985,Health Care,Biotechnology: Pharmaceutical Preparations
PRPL,Purple Innovation Inc. Common Stock,$1.61,0.08,5.229%,172611811.00,United States,2015,661809,Consumer Discretionary,Home Furnishings
PRPO,Precipio Inc.  Common Stock,$6.02,-0.23,-3.68%,8549153.00,United States,,593,Industrials,Biotechnology: Laboratory Analytical Instruments
PRQR,ProQR Therapeutics N.V. Ordinary Shares,$2.47,-0.04,-1.594%,200945842.00,Netherlands,2014,155515,Health Care,Biotechnology: Pharmaceutical Preparations
PRS,Prudential Financial Inc. 5.625% Junior Subordinated Notes due 2058,$25.12,0.09,0.36%,9018080000.00,United States,2018,21371,Finance,Life Insurance
PRSO,Peraso Inc. Common Stock,$1.43,0.05,3.623%,946496.00,United States,,140295,Technology,Semiconductors
PRST,Presto Automation Inc. Common Stock,$0.26,0.0283,12.214%,21005911.00,United States,2021,2558484,Technology,EDP Services
PRSTW,Presto Automation Inc. Warrant,$0.0265,0.0059,28.641%,2140987.00,United States,2021,52411,Technology,EDP Services
PRT,PermRock Royalty Trust Trust Units,$4.18,-0.31,-6.904%,50852760.00,United States,2018,82180,Energy,Oil & Gas Production
PRTA,Prothena Corporation plc Ordinary Shares,$25.51,0.42,1.674%,1370408807.00,United States,,423132,Health Care,Biotechnology: Pharmaceutical Preparations
PRTC,PureTech Health plc American Depositary Shares,$28.00,-0.3775,-1.33%,766825220.00,United States,,557,Health Care,Biotechnology: Pharmaceutical Preparations
PRTG,Portage Biotech Inc. Common Stock,$0.45,-0.10,-18.182%,8900201.00,Canada,,12491,Energy,Oil & Gas Production
PRTH,Priority Technology Holdings Inc. Common Stock,$3.15,-0.10,-3.077%,238747758.00,United States,2016,66323,Technology,EDP Services
PRTS,CarParts.com Inc. Common Stock,$1.69,0.11,6.962%,95649746.00,United States,2007,812731,Consumer Discretionary,Auto & Home Supply Stores
PRU,Prudential Financial Inc. Common Stock,$115.33,1.53,1.344%,41403470000.00,United States,2001,1616375,Finance,Life Insurance
PRVA,Privia Health Group Inc. Common Stock,$20.90,0.02,0.096%,2478088463.00,United States,2021,466209,Technology,Retail: Computer Software & Peripheral Equipment
PRZO,ParaZero Technologies Ltd. Ordinary Shares,$0.623,0.0026,0.419%,3770656.00,Israel,2023,206526,,
PSA,Public Storage Common Stock,$282.03,4.72,1.702%,49550246670.00,United States,,500116,Real Estate,Real Estate Investment Trusts
PSA^F,Public Storage Depositary Shares Each Representing 1/1000 of a 5.15% Cumulative Preferred Share of Beneficial Interest Series F par value $0.01 per share,$24.71,0.05,0.203%,,United States,,13385,,
PSA^G,Public Storage Depositary Shares Each Representing 1/1000 of a 5.05% Cumulative Preferred Share of Beneficial Interest Series G,$24.78,0.11,0.446%,,United States,,18036,,
PSA^H,Public Storage Depositary Shares Each Representing 1/1000 of a  5.60% Cumulative Preferred  Share of Beneficial Interest Series H,$25.07,0.01,0.04%,,United States,,18353,,
PSA^I,Public Storage Depositary Shares Each Representing 1/1000 of a 4.875% Cumulative Preferred Share of Beneficial Interest Series I par value $0.01 per share,$23.35,-0.19,-0.807%,,United States,,21095,,
PSA^J,Public Storage Depositary Shares Each Representing 1/1000 of a 4.700% Cumulative Preferred Share of Beneficial Interest Series J par value $0.01 per share,$21.89,-0.085,-0.387%,,United States,,29844,,
PSA^K,Public Storage Depositary Shares Each Representing 1/1000 of a 4.75% Cumulative Preferred Share of Beneficial Interest Series K,$22.10,-0.04,-0.181%,,United States,,14214,,
PSA^L,Public Storage Depositary Shares Each Representing 1/1000 of a 4.625% Cumulative Preferred Share of Beneficial Interest Series L par value $0.01 per share,$21.85,-0.18,-0.817%,,United States,,37100,,
PSA^M,Public Storage Depositary Shares Each Representing 1/1000 of a 4.125% Cumulative Preferred Share of Beneficial Interest Series M,$19.74,-0.08,-0.404%,,United States,,24615,,
PSA^N,Public Storage Depositary Shares Each Representing 1/1000 of a 3.875% Cumulative Preferred Share of Beneficial Interest Series N,$18.28,0.03,0.164%,,United States,,12154,,
PSA^O,Public Storage Depositary Shares Each Representing 1/1000 of a 3.900% Cumulative Preferred Share of Beneficial Interest Series O,$18.29,0.0984,0.541%,,United States,,7667,,
PSA^P,Public Storage Depositary Shares Each Representing 1/1000 of a 4.000% Cumulative Preferred Share of Bene cial Interest Series P,$19.19,0.13,0.682%,,United States,,27280,,
PSA^Q,Public Storage Depositary Shares Each Representing 1/1000 of a 3.950% Cumulative Preferred Share of Beneficial Interest Series Q par value $0.01 per share,$18.46,-0.0029,-0.016%,,United States,,9894,,
PSA^R,Public Storage Depositary Shares Each Representing 1/1000 of a 4.00% Cumulative Preferred Share of Bene cial Interest Series R,$19.06,-0.01,-0.052%,,United States,,26474,,
PSA^S,Public Storage Depositary Shares Each Representing 1/1000 of a 4.100% Cumulative Preferred Share of Beneficial Interest Series S,$19.35,-0.11,-0.565%,,United States,,10818,,
PSBD,Palmer Square Capital BDC Inc. Common Stock,$16.74,0.36,2.198%,0.00,,2024,15003,,
PSEC,Prospect Capital Corporation Common Stock,$5.46,-0.02,-0.365%,2260371805.00,United States,2004,2282583,Finance,Finance/Investors Services
PSEC^A,Prospect Capital Corporation 5.35% Series A Fixed Rate Cumulative Perpetual Preferred Stock,$18.39,0.36,1.997%,,United States,,6569,,
PSF,Cohen & Steers Select Preferred and Income Fund Inc. Common Stock,$19.77,0.02,0.101%,971470676.00,,2010,17114,Finance,Investment Managers
PSFE,Paysafe Limited Common Shares,$15.35,0.62,4.209%,946367917.00,,2021,600373,Consumer Discretionary,Business Services
PSHG,Performance Shipping Inc. Common Shares,$1.89,0.06,3.279%,22497445.00,Greece,,76664,Consumer Discretionary,Marine Transportation
PSMT,PriceSmart Inc. Common Stock,$81.50,0.81,1.004%,2487035418.00,United States,,80560,Consumer Discretionary,Department/Specialty Retail Stores
PSN,Parsons Corporation Common Stock,$81.70,0.56,0.69%,8646276604.00,United States,2019,518644,Technology,EDP Services
PSNL,Personalis Inc. Common Stock,$1.51,-0.11,-6.79%,76260872.00,United States,2019,981268,Health Care,Medical Specialities
PSNY,Polestar Automotive Holding UK PLC Class A ADS,$1.61,0.09,5.921%,3397006620.00,Sweden,,1483050,Consumer Discretionary,Auto Manufacturing
PSNYW,Polestar Automotive Holding UK PLC Class C-1 ADS (ADW),$0.1675,-0.0025,-1.471%,353415285.00,Sweden,,31430,Consumer Discretionary,Auto Manufacturing
PSO,Pearson Plc Common Stock,$12.96,0.12,0.935%,8911369250.00,United Kingdom,,548281,Consumer Discretionary,Books
PSQH,PSQ Holdings Inc. Class A Common Stock,$5.00,0.11,2.249%,141436265.00,,2021,144048,Consumer Discretionary,Advertising
PSTG,Pure Storage Inc. Class A Common Stock,$51.79,2.01,4.038%,16364232348.00,United States,2015,3482012,Technology,Electronic Components
PSTL,Postal Realty Trust Inc. Class A Common Stock,$14.11,0.11,0.786%,317641893.00,United States,2019,79058,Real Estate,Real Estate Investment Trusts
PSTV,PLUS THERAPEUTICS Inc. Common Stock ,$1.86,0.01,0.541%,7953513.00,United States,,12897,Health Care,Medical/Dental Instruments
PSTX,Poseida Therapeutics Inc. Common Stock,$2.97,0.06,2.062%,286572707.00,United States,2020,915518,Health Care,Biotechnology: Biological Products (No Diagnostic Substances)
PSX,Phillips 66 Common Stock,$158.76,1.77,1.127%,67921406348.00,United States,,2389137,Energy,Integrated oil Companies
PT,Pintec Technology Holdings Limited American Depositary Shares,$1.07,-0.01,-0.926%,9285418.00,China,2018,9759,Technology,Computer Software: Programming Data Processing
PTA,Cohen & Steers Tax-Advantaged Preferred Securities and Income Fund Common Shares of Beneficial Interest,$19.63,0.34,1.763%,1085017961.00,United States,2020,172490,Finance,Trusts Except Educational Religious and Charitable
PTC,PTC Inc. Common Stock,$189.78,2.92,1.563%,22688655421.00,United States,,707968,Technology,Computer Software: Prepackaged Software
PTCT,PTC Therapeutics Inc. Common Stock,$29.51,-0.92,-3.023%,2260702965.00,United States,2013,782919,Health Care,Biotechnology: Pharmaceutical Preparations
PTEN,Patterson-UTI Energy Inc. Common Stock,$11.73,-0.19,-1.594%,4788094928.00,United States,1993,8741581,Energy,Oil & Gas Production
PTGX,Protagonist Therapeutics Inc. Common Stock,$28.88,0.06,0.208%,1682981942.00,United States,2016,465566,Health Care,Biotechnology: Pharmaceutical Preparations
PTIX,Protagenic Therapeutics Inc. Common Stock,$1.35,0.055,4.247%,5987428.00,United States,,44440,Health Care,Biotechnology: Pharmaceutical Preparations
PTIXW,Protagenic Therapeutics Inc. Warrant,$0.0319,0.0019,6.333%,141481.00,United States,,9000,Health Care,Biotechnology: Pharmaceutical Preparations
PTLO,Portillo's Inc. Class A Common Stock,$13.84,0.55,4.138%,770191350.00,United States,2021,694260,Consumer Discretionary,Restaurants
PTMN,Portman Ridge Finance Corporation Common Stock,$19.34,0.14,0.729%,180611232.00,United States,2006,83652,Finance,Finance/Investors Services
PTN,Palatin Technologies Inc. Common Stock,$1.57,0.01,0.641%,25334525.00,United States,1999,254687,Health Care,Biotechnology: Pharmaceutical Preparations
PTON,Peloton Interactive Inc. Class A Common Stock,$4.45,0.19,4.46%,1632583755.00,United States,2019,8591734,Consumer Discretionary,Recreational Games/Products/Toys
PTPI,Petros Pharmaceuticals Inc. Common Stock,$1.41,-0.04,-2.759%,3103507.00,United States,,969554,Health Care,Biotechnology: Pharmaceutical Preparations
PTSI,P.A.M. Transportation Services Inc. Common Stock,$16.36,1.07,6.998%,360488706.00,United States,1986,19278,Industrials,Trucking Freight/Courier Services
PTVE,Pactiv Evergreen Inc. Common stock,$13.72,0.49,3.704%,2449803220.00,United States,2020,609534,Consumer Discretionary,Containers/Packaging
PTWO,Pono Capital Two Inc. Class A Common Stock,$12.875,0.375,3.00%,0.00,United States,2022,1770,Finance,Blank Checks
PTY,Pimco Corporate & Income Opportunity Fund,$14.58,0.05,0.344%,0.00,United States,2002,496514,Finance,Investment Managers
PUBM,PubMatic Inc. Class A Common Stock,$23.39,0.51,2.229%,1169700078.00,United States,2020,413993,Technology,Computer Software: Prepackaged Software
PUCKW,Goal Acquisitions Corp. Warrant,$0.0101,0.00,0.00%,0.00,United States,2021,94083,Finance,Blank Checks
PUK,Prudential Public Limited Company Common Stock,$19.25,-0.77,-3.846%,26499702479.00,United Kingdom,,1635971,Finance,Life Insurance
PULM,Pulmatrix Inc. Common Stock,$1.6477,0.0277,1.71%,6017870.00,United States,2014,12062,Health Care,Biotechnology: Pharmaceutical Preparations
PUMP,ProPetro Holding Corp. Common Stock,$7.74,0.03,0.389%,832569153.00,United States,2017,1153913,Energy,Oilfield Services/Equipment
PVBC,Provident Bancorp Inc. (MD) Common Stock,$9.00,0.14,1.58%,159137244.00,United States,2015,42700,Finance,Banks
PVH,PVH Corp. Common Stock,$137.40,4.95,3.737%,8194193462.00,United States,,1006661,Consumer Discretionary,Apparel
PVL,Permianville Royalty Trust Trust Units ,$1.33,-0.01,-0.746%,43890000.00,United States,2011,84730,Energy,Oil & Gas Production
PW,Power REIT (MD) Common Stock,$0.5604,-0.0491,-8.056%,1899566.00,United States,1998,11969,Real Estate,Real Estate Investment Trusts
PWFL,PowerFleet Inc. Common Stock,$4.61,0.53,12.99%,171548721.00,United States,,2031665,Telecommunications,Telecommunications Equipment
PWM,Prestige Wealth Inc. Class A Ordinary Shares,$1.61,0.21,15.00%,14731500.00,Hong Kong,2023,297164,,
PWOD,Penns Woods Bancorp Inc. Common Stock,$18.77,0.33,1.79%,141035865.00,United States,,33709,Finance,Major Banks
PWP,Perella Weinberg Partners Class A Common Stock,$13.88,0.18,1.314%,1198181090.00,United States,2020,225680,Finance,Finance: Consumer Services
PWR,Quanta Services Inc. Common Stock,$249.51,3.12,1.266%,36365827002.00,United States,,822416,Industrials,Engineering & Construction
PWSC,PowerSchool Holdings Inc. Class A Common Stock,$21.15,0.17,0.81%,4284849458.00,United States,2021,551983,Technology,Computer Software: Prepackaged Software
PWUP,PowerUp Acquisition Corp. Class A Ordinary Shares,$11.05,0.045,0.409%,0.00,United States,2022,6249,Finance,Blank Checks
PX,P10 Inc. Class A Common Stock,$8.25,0.21,2.612%,955986364.00,United States,2021,714726,Finance,Investment Managers
PXD,Pioneer Natural Resources Company Common Stock,$254.02,-0.32,-0.126%,59344945196.00,United States,,930666,Energy,Oil & Gas Production
PXDT,Pixie Dust Technologies Inc. American Depositary Shares ,$2.70,0.15,5.882%,39696121.00,Japan,2023,10193,,
PXLW,Pixelworks Inc.  Common Stock,$2.92,0.14,5.036%,168766869.00,United States,2000,345515,Technology,Semiconductors
PXMD,PaxMedica Inc. Common Stock,$0.6399,-0.0002,-0.031%,4740422.00,United States,2022,101402,Health Care, Medicinal Chemicals and Botanical Products 
PXS,Pyxis Tankers Inc. Common Stock,$4.70,0.03,0.642%,50525000.00,Greece,,23760,Consumer Discretionary,Marine Transportation
PXSAP,Pyxis Tankers Inc. 7.75% Series A Cumulative Convertible Preferred Shares,$24.75,-0.0499,-0.201%,313194717.00,Greece,,469,Consumer Discretionary,Marine Transportation
PXSAW,Pyxis Tankers Inc. Warrant,$1.19,-0.04,-3.252%,15058655.00,Greece,,5203,Consumer Discretionary,Marine Transportation
PYCR,Paycor HCM Inc. Common Stock,$19.46,0.14,0.725%,3464464851.00,United States,2021,435247,Technology,Computer Software: Prepackaged Software
PYN,PIMCO New York Municipal Income Fund III Common Shares of Beneficial Interest,$5.8788,0.0038,0.065%,0.00,United States,2002,23995,Finance,Investment Managers
PYPD,PolyPid Ltd. Ordinary Shares,$4.536,-0.619,-12.008%,7500544.00,Israel,2020,2302,Health Care,Medical/Dental Instruments
PYPL,PayPal Holdings Inc. Common Stock,$65.05,2.04,3.238%,69716808253.00,United States,,12641434,Consumer Discretionary,Business Services
PYT,PPlus Tr GSC-2 Tr Ctf Fltg Rate,$22.82,0.0798,0.351%,0.00,United States,,1807,Finance,Finance: Consumer Services
PYXS,Pyxis Oncology Inc. Common Stock,$5.43,0.28,5.437%,240674140.00,United States,2021,462255,Health Care,Biotechnology: Pharmaceutical Preparations
PZC,PIMCO California Municipal Income Fund III Common Shares of Beneficial Interest,$7.56,-0.07,-0.917%,0.00,United States,2002,38290,Finance,Investment Managers
PZG,Paramount Gold Nevada Corp. Common Stock,$0.3949,0.0101,2.625%,23816551.00,United States,2015,21655,Basic Materials,Metal Mining
PZZA,Papa John's International Inc. Common Stock,$71.75,-0.14,-0.195%,2351037488.00,United States,1993,426142,Consumer Discretionary,Restaurants
QBTS,D-Wave Quantum Inc. Common Shares,$2.05,-0.12,-5.53%,232473303.00,,2022,5505659,Technology,Retail: Computer Software & Peripheral Equipment
QCOM,QUALCOMM Incorporated Common Stock,$167.67,3.57,2.176%,187119720000.00,United States,1991,5995811,Technology,Radio And Television Broadcasting And Communications Equipment
QCRH,QCR Holdings Inc. Common Stock,$58.38,2.29,4.083%,980368334.00,United States,,105192,Finance,Major Banks
QD,Qudian Inc. American Depositary Shares each representing one Class A Ordinary Share,$2.51,0.04,1.619%,582938278.00,China,2017,759399,Finance,Finance: Consumer Services
QDEL,QuidelOrtho Corporation Common Stock,$47.42,-0.96,-1.984%,3170002816.00,United States,,895416,Health Care,Medical Specialities
QDRO,Quadro Acquisition One Corp. Class A Ordinary Shares,$10.97,0.00,0.00%,0.00,United States,2021,134066,Finance,Blank Checks
QETA,Quetta Acquisition Corporation Common Stock,$10.17,-0.0067,-0.066%,0.00,United States,2023,2100,,
QETAR,Quetta Acquisition Corporation Right,$1.05,0.04,3.96%,0.00,United States,2023,405,,
QFIN,Qifu Technology Inc. American Depositary Shares,$19.90,1.43,7.742%,3211781037.00,China,2018,2465809,Finance,Finance: Consumer Services
QGEN,Qiagen N.V. Common Shares,$43.95,-0.06,-0.136%,10029511082.00,Netherlands,,770696,Health Care,Biotechnology: Biological Products (No Diagnostic Substances)
QH,Quhuo Limited American Depository Shares,$1.22,0.00,0.00%,7524498.00,China,2020,12921,Consumer Discretionary,Business Services
QIPT,Quipt Home Medical Corp. Common Shares,$4.28,0.06,1.422%,180198576.00,United States,,119582,,
QLGN,Qualigen Therapeutics Inc. Common Stock,$0.3608,0.0071,2.007%,1869326.00,United States,2015,39446,Health Care,Biotechnology: Pharmaceutical Preparations
QLI,Qilian International Holding Group Ltd. Ordinary Shares,$0.6092,0.0043,0.711%,21778900.00,China,2021,2845,Health Care,Biotechnology: Pharmaceutical Preparations
QLYS,Qualys Inc. Common Stock,$167.19,3.60,2.201%,6182227932.00,United States,2012,581072,Technology,EDP Services
QMCO,Quantum Corporation Common Stock,$0.619,0.039,6.724%,58830136.00,United States,,175361,Technology,Electronic Components
QNCX,Quince Therapeutics Inc. Common Stock,$1.15,-0.06,-4.959%,49299289.00,United States,2019,37249,Health Care,Biotechnology: Biological Products (No Diagnostic Substances)
QNRX,Quoin Pharmaceuticals Ltd. American Depositary Shares,$0.90,0.01,1.124%,3317373.00,Israel,2016,95498,Health Care,Medical/Dental Instruments
QNST,QuinStreet Inc. Common Stock,$17.11,-0.24,-1.383%,939176541.00,United States,2010,486453,Consumer Discretionary,Advertising
QQQX,Nuveen NASDAQ 100 Dynamic Overwrite Fund Shares of Beneficial Interest,$23.67,0.275,1.175%,0.00,United States,,124246,Finance,Finance Companies
QRHC,Quest Resource Holding Corporation Common Stock,$7.14,0.04,0.563%,144023796.00,United States,,8732,Utilities,Environmental Services
QRTEA,Qurate Retail Inc. Series A Common Stock ,$1.18,0.07,6.306%,462262758.00,United States,,2312409,Consumer Discretionary,Catalog/Specialty Distribution
QRTEB,Qurate Retail Inc. Series B Common Stock ,$4.81,-0.30,-5.871%,1884308361.00,United States,,6252,Consumer Discretionary,Catalog/Specialty Distribution
QRTEP,Qurate Retail Inc. 8.0% Fixed Rate Cumulative Redeemable Preferred Stock,$48.75,0.42,0.869%,19097719875.00,United States,,33146,Consumer Discretionary,Catalog/Specialty Distribution
QRVO,Qorvo Inc. Common Stock,$113.52,2.72,2.455%,10960180952.00,United States,,1069845,Technology,Semiconductors
QS,QuantumScape Corporation Class A Common Stock,$5.94,0.22,3.846%,2945107967.00,United States,2020,4864775,Consumer Discretionary,Auto Parts:O.E.M.
QSG,QuantaSing Group Limited American Depositary Shares,$3.60,0.35,10.769%,198742147.00,China,2023,198286,Real Estate,Other Consumer Services
QSI,Quantum-Si Incorporated Class A Common Stock,$1.90,0.01,0.529%,269362842.00,United States,2020,943684,Health Care,Biotechnology: Pharmaceutical Preparations
QSR,Restaurant Brands International Inc. Common Shares,$80.84,-0.06,-0.074%,25244992400.00,Canada,2014,2724318,Consumer Discretionary,Restaurants
QTI,QT Imaging Holdings Inc. Common Stock,$1.08,-0.04,-3.571%,9352776.00,United States,,357473,Health Care,Biotechnology: Electromedical & Electrotherapeutic Apparatus
QTRX,Quanterix Corporation Common Stock,$25.39,-1.57,-5.823%,966435261.00,United States,2017,293498,Industrials,Biotechnology: Laboratory Analytical Instruments
QTWO,Q2 Holdings Inc. Common Stock,$51.00,0.72,1.432%,3012784761.00,United States,2014,550681,Technology,Computer Software: Prepackaged Software
QUAD,Quad Graphics Inc Class A Common Stock,$5.04,-0.06,-1.176%,263501950.00,United States,,368085,Consumer Discretionary,Publishing
QUBT,Quantum Computing Inc. Common Stock,$1.24,0.09,7.826%,93120589.00,United States,,1639451,Technology,Computer Software: Prepackaged Software
QUIK,QuickLogic Corporation Common Stock,$17.06,0.47,2.833%,237306767.00,United States,1999,419508,Technology,Semiconductors
QURE,uniQure N.V. Ordinary Shares,$5.23,0.10,1.949%,250194178.00,Netherlands,2014,594743,Health Care,Biotechnology: Pharmaceutical Preparations
QVCC,QVC Inc. 6.250% Senior Secured Notes due 2068,$14.50,0.14,0.975%,15.00,United States,2019,46637,Consumer Discretionary,Catalog/Specialty Distribution
QVCD,QVC Inc. 6.375% Senior Secured Notes due 2067,$14.69,0.24,1.661%,15.00,United States,2018,40380,Consumer Discretionary,Catalog/Specialty Distribution
R,Ryder System Inc. Common Stock,$114.83,1.70,1.503%,5042586975.00,United States,,302752,Consumer Discretionary,Rental/Leasing Companies
RA,Brookfield Real Assets Income Fund Inc. Common Stock,$12.87,0.02,0.156%,0.00,United States,2016,233506,Finance,Investment Managers
RACE,Ferrari N.V. Common Shares,$434.14,0.78,0.18%,78326709593.00,Italy,2015,242842,Consumer Discretionary,Auto Manufacturing
RAIL,FreightCar America Inc. Common Stock,$3.70,0.14,3.933%,67878306.00,United States,2005,165641,Industrials,Railroads
RAMP,LiveRamp Holdings Inc. Common Stock,$34.23,0.08,0.234%,2265469112.00,United States,2018,498523,Technology,EDP Services
RAND,Rand Capital Corporation Common Stock,$13.80,0.00,0.00%,35618090.00,United States,,33,Finance,Finance/Investors Services
RANI,Rani Therapeutics Holdings Inc. Class A Common Stock,$3.57,0.02,0.563%,178487534.00,United States,2021,40490,Health Care, Medicinal Chemicals and Botanical Products 
RAPT,RAPT Therapeutics Inc. Common Stock,$8.68,0.04,0.463%,302044053.00,United States,2019,991247,Health Care,Biotechnology: Pharmaceutical Preparations
RARE,Ultragenyx Pharmaceutical Inc. Common Stock,$47.01,0.01,0.021%,3870600646.00,United States,2014,516842,Health Care,Biotechnology: Pharmaceutical Preparations
RAVE,Rave Restaurant Group Inc. Common Stock,$1.95,0.05,2.632%,28443804.00,United States,,28653,Consumer Discretionary,Food Distributors
RAYA,Erayak Power Solution Group Inc. Class A Ordinary Shares,$0.7029,-0.0071,-1.00%,8751105.00,China,2022,31041,Consumer Discretionary,Metal Fabrications
