Symbol,Name,Last Sale,Net Change,% Change,Market Cap,Country,IPO Year,Volume,Sector,Industry
JD,JD.com Inc. American Depositary Shares,$28.14,0.55,1.993%,44222248121.00,China,2014,14761813,Consumer Discretionary,Other Specialty Stores
JEF,Jefferies Financial Group Inc. Common Stock,$44.84,0.82,1.863%,9504745920.00,United States,,749201,Finance,Investment Bankers/Brokers/Service
JELD,JELD-WEN Holding Inc. Common Stock,$19.30,0.24,1.259%,1651570441.00,United States,2017,394432,Basic Materials,Forest Products
JEQ,abrdn Japan Equity Fund Inc. Common Stock,$6.22,0.02,0.323%,84591938.00,United States,1992,70779,Consumer Discretionary,Air Freight/Delivery Services
JEWL,Adamas One Corp. Common Stock,$0.3464,0.0161,4.874%,9697110.00,United States,2022,110546,Consumer Discretionary,Consumer Specialties
JFBR,Jeffs' Brands Ltd Ordinary Shares,$0.3601,0.0145,4.196%,428089.00,Israel,2022,352686,Consumer Discretionary,Other Specialty Stores
JFBRW,Jeffs' Brands Ltd Warrant,$0.0541,0.0183,51.117%,64314.00,Israel,2022,5492,Consumer Discretionary,Other Specialty Stores
JFIN,Jiayin Group Inc. American Depositary Shares,$7.13,-0.04,-0.558%,380969098.00,China,2019,91030,Finance,Finance: Consumer Services
JFR,Nuveen Floating Rate Income Fund Common Stock,$8.64,-0.01,-0.116%,0.00,United States,2004,522200,Finance,Trusts Except Educational Religious and Charitable
JFU,9F Inc. American Depositary Shares,$3.50,0.00,0.00%,41206666.00,China,2019,1552,Finance,Finance: Consumer Services
JG,Aurora Mobile Limited American Depositary Shares,$3.48,0.23,7.077%,20812175.00,China,2018,14748,Technology,Computer Software: Programming Data Processing
JGH,Nuveen Global High Income Fund Common Shares of Beneficial Interest,$12.64,-0.12,-0.94%,0.00,United States,2014,59860,Finance,Investment Managers
JHG,Janus Henderson Group plc Ordinary Shares,$31.85,0.84,2.709%,5151230257.00,United Kingdom,2017,957920,Finance,Investment Managers
JHI,John Hancock Investors Trust Common Stock,$13.13,0.03,0.229%,114815902.00,United States,,16176,Finance,Trusts Except Educational Religious and Charitable
JHS,John Hancock Income Securities Trust Common Stock,$11.01,0.05,0.456%,128228901.00,United States,,17732,Finance,Finance Companies
JHX,James Hardie Industries plc American Depositary Shares (Ireland),$40.10,0.34,0.855%,17726457470.00,Ireland,,22169,Industrials,Building Materials
JILL,J. Jill Inc. Common Stock,$26.47,1.74,7.036%,280653601.00,United States,2017,461449,Consumer Discretionary,Clothing/Shoe/Accessory Stores
JJSF,J & J Snack Foods Corp. Common Stock,$141.15,-0.90,-0.634%,2735465404.00,United States,1986,76165,Consumer Staples,Specialty Foods
JKHY,Jack Henry & Associates Inc. Common Stock,$171.50,0.45,0.263%,12496806777.00,United States,1985,231857,Technology,Retail: Computer Software & Peripheral Equipment
JKS,JinkoSolar Holding Company Limited American Depositary Shares (each representing 4 Common Shares),$24.90,-1.55,-5.86%,1254087629.00,China,2010,2290011,Technology,Semiconductors
JL,J-Long Group Limited Ordinary Shares,$1.42,0.02,1.429%,44588000.00,Hong Kong,2024,877709,,
JLL,Jones Lang LaSalle Incorporated Common Stock,$187.94,2.47,1.332%,8916364687.00,United States,,190351,Finance,Real Estate
JLS,Nuveen Mortgage and Income Fund,$17.73,0.00,0.00%,0.00,United States,2009,10808,Finance,Investment Managers
JMIA,Jumia Technologies AG American Depositary Shares each representing two Ordinary Shares,$6.08,-0.12,-1.935%,611746982.00,,2019,2948406,Consumer Discretionary,Catalog/Specialty Distribution
JMM,Nuveen Multi-Market Income Fund (MA),$6.0393,0.0093,0.154%,0.00,United States,,409,Finance,Trusts Except Educational Religious and Charitable
JMSB,John Marshall Bancorp Inc. Common Stock,$18.20,0.57,3.233%,257094729.00,United States,,14233,Finance,Major Banks
JNJ,Johnson & Johnson Common Stock,$155.76,-0.45,-0.288%,375189583433.00,United States,,5982304,Health Care,Biotechnology: Pharmaceutical Preparations
JNPR,Juniper Networks Inc. Common Stock,$36.82,0.11,0.30%,11852629216.00,United States,1999,2354261,Telecommunications,Computer Communications Equipment
JNVR,Janover Inc. Common Stock,$1.44,0.01,0.699%,14392905.00,United States,2023,8099,Finance,Finance: Consumer Services
JOAN,JOANN Inc. Common Stock,$0.135,0.001,0.746%,5658073.00,United States,2021,9061228,Consumer Discretionary,Other Specialty Stores
JOB,GEE Group Inc. Common Stock,$0.3573,0.0058,1.65%,38864085.00,United States,1968,143563,Consumer Discretionary,Diversified Commercial Services
JOBY,Joby Aviation Inc. Common Stock,$5.18,0.15,2.982%,3640799768.00,United States,2020,6351626,Consumer Discretionary,Aerospace
JOE,St. Joe Company (The) Common Stock,$54.56,0.91,1.696%,3184778502.00,United States,,138781,Real Estate,Homebuilding
JOF,Japan Smaller Capitalization Fund Inc Common Stock,$7.89,0.00,0.00%,0.00,United States,1990,84352,Finance,Trusts Except Educational Religious and Charitable
JOUT,Johnson Outdoors Inc. Class A Common Stock,$44.77,0.91,2.075%,460400712.00,United States,,51727,Consumer Discretionary,Recreational Games/Products/Toys
JPC,Nuveen Preferred & Income Opportunities Fund,$7.22,0.05,0.697%,0.00,United States,2003,820492,Finance,Investment Managers
JPI,Nuveen Preferred and Income Term Fund Common Shares of Beneficial Interest,$18.98,0.12,0.636%,432220513.00,,2012,37228,Finance,Finance Companies
JPM,JP Morgan Chase & Co. Common Stock,$196.33,2.54,1.311%,565503336202.00,United States,,9367043,Finance,Major Banks
JPM^C,J P Morgan Chase & Co Depositary Shares each representing a 1/400th interest in a share of 6.00% Non-Cumulative  Preferred Stock Series EE,$25.18,0.02,0.079%,,United States,,70167,,
JPM^D,J P Morgan Chase & Co Depositary Shares each representing a 1/400th  interest in a share of 5.75% Non-Cumulative  Preferred Stock Series DD,$25.22,0.05,0.199%,,United States,,89144,,
JPM^J,J P Morgan Chase & Co Depositary Shares each representing a 1/400th interest in a share of JPMorgan Chase & Co. 4.75% Non-Cumulative Preferred Stock Series GG,$22.55,0.05,0.222%,,United States,,40671,,
JPM^K,J P Morgan Chase & Co Depositary Shares each representing a 1/400th interest in a share of 4.55% Non-Cumulative Preferred Stock Series JJ,$21.35,0.01,0.047%,,United States,,82514,,
JPM^L,J P Morgan Chase & Co Depositary Shares each representing a 1/400th interest in a share of 4.625% Non-Cumulative Preferred Stock Series LL,$21.65,0.00,0.00%,,United States,,110870,,
JPM^M,J P Morgan Chase & Co Depositary Shares each representing a 1/400th interest in a share of 4.20% Non-Cumulative Preferred Stock Series MM,$20.02,-0.06,-0.299%,,United States,,253286,,
JQC,Nuveen Credit Strategies Income Fund Shares of Beneficial Interest,$5.61,0.04,0.718%,0.00,United States,2003,450721,Finance,Finance Companies
JRI,Nuveen Real Asset Income and Growth Fund Common Shares of Beneficial Interest,$11.49,0.08,0.701%,0.00,United States,2012,48769,Finance,Finance Companies
JRS,Nuveen Real Estate Income Fund Common Shares of Beneficial Interest,$7.65,0.08,1.057%,0.00,United States,2001,70855,Finance,Finance/Investors Services
JRSH,Jerash Holdings (US) Inc. Common Stock,$2.9599,0.0799,2.774%,36391497.00,United States,2018,7269,Consumer Discretionary,Apparel
JRVR,James River Group Holdings Ltd. Common Shares,$8.16,0.41,5.29%,307306277.00,Bermuda,2014,2413364,Finance,Property-Casualty Insurers
JSM,Navient Corporation 6% Senior Notes due December 15 2043,$21.54,0.08,0.373%,2428632501.00,United States,,8719,Finance,Finance: Consumer Services
JSPR,Jasper Therapeutics Inc. Common Stock,$27.47,1.23,4.688%,413805223.00,United States,2020,113471,Health Care,Biotechnology: Biological Products (No Diagnostic Substances)
JSPRW,Japer Therapeutics Inc. Warrants,$0.1657,-0.0243,-12.789%,2496088.00,United States,2020,11598,Health Care,Biotechnology: Biological Products (No Diagnostic Substances)
JTAI,Jet.AI Inc. Common Stock,$0.928,-0.0671,-6.743%,8366304.00,Cayman Islands,2021,1306320,Finance,Blank Checks
JTAIW,Jet.AI Inc. Warrant,$0.05,-0.02,-28.571%,0.00,Cayman Islands,2021,13698,Finance,Blank Checks
JTAIZ,Jet.AI Inc. Merger Consideration Warrants,$0.5707,-0.0143,-2.444%,5145097.00,Cayman Islands,,1612,,
JVA,Coffee Holding Co. Inc. Common Stock,$1.33,0.02,1.527%,7592437.00,United States,2005,16724,Consumer Staples,Packaged Foods
JVSA,JV SPAC Acquisition Corp. Class A Ordinary Share,$10.06,0.00,0.00%,0.00,China,2024,107506,,
JVSAR,JV SPAC Acquisition Corp. Right,$0.238,0.00,0.00%,0.00,China,2024,1,,
JVSAU,JVSPAC Acquisition Corp. Unit,$10.26,0.00,0.00%,0.00,China,2024,5,,
JWEL,Jowell Global Ltd. Ordinary Shares,$1.28,-0.04,-3.03%,2729965.00,China,2021,5795,Consumer Discretionary,Other Consumer Services
JWN,Nordstrom Inc. Common Stock,$19.38,0.72,3.859%,3163944265.00,United States,,5896141,Consumer Discretionary,Clothing/Shoe/Accessory Stores
JWSM,Jaws Mustang Acquisition Corp. Class A Ordinary Shares,$11.04,-0.01,-0.09%,0.00,,2021,9080,Finance,Blank Checks
JXJT,JX Luxventure Limited Common Stock,$1.26,-0.04,-3.077%,7635600.00,China,2013,39435,Consumer Staples,Apparel
JXN,Jackson Financial Inc. Class A Common Stock ,$65.61,3.48,5.601%,5079019100.00,United States,2021,871450,Finance,Life Insurance
JXN^A,Jackson Financial Inc. Depositary Shares each representing a 1/1000th interest in a share of Fixed-Rate Reset Noncumulative Perpetual Preferred Stock Series A,$26.18,0.08,0.307%,,United States,,45068,,
JYD,Jayud Global Logistics Limited Class A Ordinary Shares,$0.99,-0.04,-3.883%,21223125.00,China,2023,10652,Consumer Discretionary,Oil Refining/Marketing
JYNT,The Joint Corp. Common Stock,$12.79,-0.30,-2.292%,188988148.00,United States,2014,71695,Miscellaneous,Multi-Sector Companies
JZ,Jianzhi Education Technology Group Company Limited American Depositary Shs,$2.15,0.1634,8.225%,43397750.00,China,2022,16354,Real Estate,Other Consumer Services
JZXN,Jiuzi Holdings Inc. Ordinary Shares,$2.905,0.265,10.038%,7508829.00,China,2021,200457,Consumer Discretionary,Retail-Auto Dealers and Gas Stations
K,Kellanova Common Stock,$55.14,-0.06,-0.109%,18784999532.00,United States,,3398166,Consumer Staples,Packaged Foods
KA,Kineta Inc. Common Stock,$0.565,0.0282,5.253%,5872365.00,United States,2016,50315,Health Care,Biotechnology: Pharmaceutical Preparations
KACL,Kairous Acquisition Corp. Limited Ordinary Shares,$11.75,0.09,0.772%,0.00,Malaysia,2022,98216,Finance,Blank Checks
KAI,Kadant Inc Common Stock,$321.06,5.42,1.717%,3762440496.00,United States,1992,82584,Industrials,Industrial Machinery/Components
KALA,KALA BIO Inc. Common Stock,$7.95,0.23,2.979%,21410272.00,United States,2017,21093,Health Care,Biotechnology: Pharmaceutical Preparations
KALU,Kaiser Aluminum Corporation Common Stock,$82.08,2.85,3.597%,1314576125.00,United States,,159492,Industrials,Metal Fabrications
KALV,KalVista Pharmaceuticals Inc. Common Stock,$12.23,0.39,3.294%,515962860.00,United Kingdom,2015,446809,Health Care,Biotechnology: Pharmaceutical Preparations
KAMN,Kaman Corporation Common Stock,$45.78,-0.07,-0.153%,1296450046.00,United States,,217668,Industrials,Military/Government/Technical
KAR,OPENLANE Inc. Common Stock,$16.65,0.15,0.909%,1798958557.00,United States,2009,539527,Consumer Discretionary,Retail-Auto Dealers and Gas Stations
KARO,Karooooo Ltd. Ordinary Shares,$26.33,0.79,3.093%,814942621.00,Singapore,2021,12133,Technology,Computer Software: Prepackaged Software
KAVL,Kaival Brands Innovations Group Inc. Common Stock,$1.33,-0.17,-11.333%,3785626.00,United States,,72733,Health Care, Medicinal Chemicals and Botanical Products 
KB,KB Financial Group Inc,$55.84,1.49,2.741%,21757181266.00,South Korea,,107257,Finance,Commercial Banks
KBH,KB Home Common Stock,$69.89,1.66,2.433%,5302346587.00,United States,1986,1299014,Consumer Discretionary,Homebuilding
KBR,KBR Inc. Common Stock,$60.38,-0.05,-0.083%,8155619646.00,United States,2006,749181,Industrials,Military/Government/Technical
KC,Kingsoft Cloud Holdings Limited American Depositary Shares,$3.74,0.52,16.149%,948784342.00,China,2020,5240004,Technology,Computer Software: Prepackaged Software
KCGI,Kensington Capital Acquisition Corp. V Class A Ordinary Shares,$10.83,0.00,0.00%,0.00,,2021,1,Finance,Blank Checks
KD,Kyndryl Holdings Inc. Common Stock,$22.34,0.44,2.009%,5140508794.00,United States,2021,1162805,Technology,EDP Services
KDP,Keurig Dr Pepper Inc. Common Stock,$29.71,0.40,1.365%,41225328907.00,United States,,12464515,Consumer Staples,Beverages (Production/Distribution)
KE,Kimball Electronics Inc. Common Stock,$20.96,0.81,4.02%,521258558.00,United States,,119789,Technology,Industrial Machinery/Components
KELYA,Kelly Services Inc. Class A Common Stock,$24.35,0.54,2.268%,859277629.00,United States,,236235,Consumer Discretionary,Professional Services
KELYB,Kelly Services Inc. Class B Common Stock,$23.45,0.00,0.00%,827517881.00,United States,,23,Consumer Discretionary,Professional Services
KEN,Kenon Holdings Ltd. Ordinary Shares,$24.75,-0.1019,-0.41%,1333777500.00,Singapore,2015,4600,Utilities,Electric Utilities: Central
KEP,Korea Electric Power Corporation Common Stock,$8.49,0.05,0.592%,10900550027.00,South Korea,1994,99516,Utilities,Electric Utilities: Central
KEQU,Kewaunee Scientific Corporation Common Stock,$32.42,0.62,1.95%,93210872.00,United States,,7431,Industrials,Medical Specialities
KEX,Kirby Corporation Common Stock,$91.04,1.00,1.111%,5327842880.00,United States,,357756,Consumer Discretionary,Marine Transportation
KEY,KeyCorp Common Stock,$15.04,0.55,3.796%,14044979048.00,United States,,9810855,Finance,Major Banks
KEY^I,KeyCorp Depositary Shares Each Representing a 1/40th Ownership Interest in a Share of Fixed-to-Floating Rate Perpetual Non-Cumulative Preferred Stock Series E,$23.5213,-0.0987,-0.418%,,United States,,27966,,
KEY^J,KeyCorp Depositary Shares each representing a 1/40th ownership interest in a share of Fixed Rate Perpetual Non-Cumulative Preferred Stock Series F,$21.19,-0.13,-0.61%,,United States,,32099,,
KEY^K,KeyCorp Depositary Shares each representing a 1/40th ownership interest in a share of Fixed Rate Perpetual Non-Cumulative Preferred Stock Series G,$21.75,-0.06,-0.275%,,United States,,56470,,
KEY^L,KeyCorp Depositary Shares each representing a 1/40th ownership interest in a share of Fixed Rate Perpetual Non-Cumulative Preferred Stock Series H,$22.80,-0.05,-0.219%,,United States,,62764,,
KEYS,Keysight Technologies Inc. Common Stock,$150.68,1.10,0.735%,26302074273.00,United States,2014,1080183,Industrials,Industrial Machinery/Components
KF,Korea Fund Inc. (The) New Common Stock,$24.795,0.325,1.328%,0.00,United States,,19921,Finance,Investment Managers
KFFB,Kentucky First Federal Bancorp Common Stock,$3.79,0.00,0.00%,30648650.00,United States,2005,1674,Finance,Savings Institutions
KFRC,Kforce Inc. Common Stock,$70.16,1.97,2.889%,1369382880.00,United States,1995,98907,Consumer Discretionary,Professional Services
KFS,Kingsway Financial Services Inc. Common Stock (DE),$8.59,0.15,1.777%,241561718.00,Canada,,31214,Finance,Property-Casualty Insurers
KFY,Korn Ferry Common Stock,$64.39,0.95,1.497%,3359885589.00,United States,1999,295358,Consumer Discretionary,Diversified Commercial Services
KGC,Kinross Gold Corporation Common Stock,$5.79,0.27,4.891%,7109541000.00,Canada,2001,16493270,,
KGEI,Kolibri Global Energy Inc. Common stock,$3.39,0.06,1.802%,120770740.00,United States,,6173,,
KGS,Kodiak Gas Services Inc. Common Stock,$26.85,0.27,1.016%,2079118392.00,,2023,323524,,
KHC,The Kraft Heinz Company Common Stock,$35.35,0.08,0.227%,42883077470.00,United States,,9952119,Consumer Staples,Packaged Foods
KIDS,OrthoPediatrics Corp. Common Stock,$27.55,0.94,3.533%,648788615.00,United States,2017,158358,Health Care,Medical/Dental Instruments
KIM,Kimco Realty Corporation (HC) Common Stock,$19.44,0.34,1.78%,13081263091.00,United States,,3660249,Real Estate,Real Estate Investment Trusts
KIM^L,Kimco Realty Corporation Class L Depositary Shares each of which represents a one-one thousandth fractional interest in a share of 5.125% Class L Cumulative Redeemable Preferred Stock liquidation preference $25000.00 per share,$23.71,0.08,0.339%,,United States,,4978,,
KIM^M,Kimco Realty Corporation Class M Depositary Shares each of which represents a one-one thousandth fractional interest in a share of 5.25% Class M Cumulative Redeemable Preferred Stock liquidation preference $25000.00 per share,$23.99,0.00,0.00%,,United States,,16466,,
KIM^N,Kimco Realty Corporation Depositary Shares each representing 1/1000th interest in a share of 7.25% Class N Cumulative Convertible Perpetual Preferred Stock,$56.95,0.95,1.696%,,United States,,2850,,
KIND,Nextdoor Holdings Inc. Class A Common Stock,$2.13,0.08,3.902%,838433804.00,United States,,1774418,Technology,Computer Software: Programming Data Processing
KINS,Kingstone Companies Inc. Common Stock,$3.85,-0.06,-1.535%,41423421.00,United States,,10302,Finance,Property-Casualty Insurers
KIO,KKR Income Opportunities Fund Common Shares,$13.24,0.08,0.608%,0.00,,2013,131799,Finance,Investment Managers
KIQ,Kelso Technologies Inc Ordinary Shares,$0.1267,-0.0016,-1.247%,6882355.00,Canada,,409121,,
KIRK,Kirkland's Inc. COMMONSTOCK,$2.50,0.01,0.402%,32309193.00,United States,2002,107826,Consumer Discretionary,Other Specialty Stores
KITT,Nauticus Robotics Inc. Common stock,$0.2359,-0.0091,-3.714%,11803451.00,United States,2021,477964,Industrials,Industrial Machinery/Components
KITTW,Nauticus Robotics Inc. Warrant,$0.0293,0.00,0.00%,1466050.00,United States,2021,88,Industrials,Industrial Machinery/Components
KKR,KKR & Co. Inc. Common Stock,$98.60,2.84,2.966%,87261855454.00,United States,,2836997,Finance,Investment Managers
KKRS,KKR Group Finance Co. IX LLC 4.625% Subordinated Notes due 2061,$20.35,0.11,0.543%,18009926557.00,United States,2021,15177,,
KLAC,KLA Corporation Common Stock,$695.95,14.89,2.186%,94115859413.00,United States,1980,904367,Technology,Electronic Components
KLG,WK Kellogg Co Common Stock,$17.38,-0.20,-1.138%,1491509558.00,United States,2023,1043601,Consumer Staples,Packaged Foods
KLIC,Kulicke and Soffa Industries Inc. Common Stock,$48.61,1.27,2.683%,2738741211.00,Singapore,,302625,Technology,Semiconductors
KLTR,Kaltura Inc. Common Stock,$1.38,0.05,3.759%,197696215.00,United States,2021,82098,Technology,EDP Services
KLXE,KLX Energy Services Holdings Inc. Common Stock,$7.72,-0.01,-0.129%,129096295.00,United States,,164940,Energy,Oilfield Services/Equipment
KMB,Kimberly-Clark Corporation Common Stock,$124.42,-0.63,-0.504%,41915007495.00,United States,,1326960,Consumer Discretionary,Containers/Packaging
KMDA,Kamada Ltd. Ordinary Shares,$5.87,0.13,2.265%,263210800.00,Israel,2013,7370,Health Care,Biotechnology: Pharmaceutical Preparations
KMI,Kinder Morgan Inc. Common Stock,$18.03,0.10,0.558%,40015240559.00,United States,2011,11145342,Utilities,Natural Gas Distribution
KMPB,Kemper Corporation 5.875% Fixed-Rate Reset Junior Subordinated Debentures due 2062,$22.86,0.04,0.175%,1470439622.00,United States,2022,25219,Finance,Property-Casualty Insurers
KMPR,Kemper Corporation,$58.95,0.84,1.446%,3791881702.00,United States,,425970,Finance,Property-Casualty Insurers
KMT,Kennametal Inc. Common Stock,$24.29,0.43,1.802%,1925463005.00,United States,,448724,Industrials,Industrial Machinery/Components
KMX,CarMax Inc,$83.08,2.23,2.758%,13120094044.00,United States,,2050372,Consumer Discretionary,Retail-Auto Dealers and Gas Stations
KN,Knowles Corporation Common Stock,$15.43,0.24,1.58%,1382988817.00,United States,2014,351943,Consumer Staples,Consumer Electronics/Appliances
KNDI,Kandi Technologies Group Inc Common Stock,$2.23,-0.01,-0.446%,194808862.00,China,,112280,Consumer Discretionary,Auto Manufacturing
KNF,Knife Riv Holding Co. Common Stock,$77.62,1.26,1.65%,4391615874.00,United States,2023,404756,,
KNOP,KNOT Offshore Partners LP Common Units representing Limited Partner Interests,$5.31,0.05,0.951%,180805500.00,United Kingdom,2013,61213,Consumer Discretionary,Marine Transportation
KNSA,Kiniksa Pharmaceuticals Ltd. Class A Common Stock,$19.78,0.08,0.406%,1396765135.00,United States,2018,364687,Health Care,Biotechnology: Pharmaceutical Preparations
KNSL,Kinsale Capital Group Inc. Common Stock,$514.97,2.08,0.406%,11941688252.00,United States,,111293,Finance,Property-Casualty Insurers
KNTE,Kinnate Biopharma Inc. Common Stock,$2.65,0.10,3.922%,124848650.00,United States,2020,1016890,Health Care,Biotechnology: Pharmaceutical Preparations
KNTK,Kinetik Holdings Inc. Class A Common Stock,$37.23,0.12,0.323%,5629405113.00,United States,2022,964490,Energy,Oil & Gas Production
KNW,Know Labs Inc. Common Stock,$0.6788,0.0129,1.937%,55218020.00,,2022,16704,Industrials,Industrial Machinery/Components
KNX,Knight-Swift Transportation Holdings Inc.,$53.45,1.37,2.631%,8625173050.00,United States,2017,1942710,Industrials,Trucking Freight/Courier Services
KO,Coca-Cola Company (The) Common Stock,$60.75,0.52,0.863%,261981712206.00,United States,,15258764,Consumer Staples,Beverages (Production/Distribution)
KOD,Kodiak Sciences Inc Common Stock,$5.78,0.43,8.037%,303289842.00,United States,2018,1192453,Health Care,Biotechnology: Biological Products (No Diagnostic Substances)
KODK,Eastman Kodak Company Common New,$4.83,0.08,1.684%,385917000.00,United States,,940858,Consumer Discretionary,Industrial Machinery/Components
KOF,Coca Cola Femsa S.A.B. de C.V.  American Depositary Shares each representing 10 Units (each Unit consists of 3 Series B Shares and 5 Series L Shares),$98.52,1.89,1.956%,20697399426.00,Mexico,1993,85071,Consumer Staples,Beverages (Production/Distribution)
KOP,Koppers Holdings Inc. Common Stock,$54.60,1.53,2.883%,1148128254.00,United States,2006,85010,Basic Materials,Forest Products
KOPN,Kopin Corporation Common Stock,$1.94,0.04,2.105%,229750326.00,United States,1992,2647529,Technology,Semiconductors
KORE,KORE Group Holdings Inc. Common Stock,$0.85,-0.036,-4.063%,73703995.00,United States,,11959,Consumer Discretionary,Telecommunications Equipment
KOS,Kosmos Energy Ltd. Common Shares (DE),$6.05,0.05,0.833%,2852590385.00,Bermuda,2011,10016079,Energy,Oil & Gas Production
KOSS,Koss Corporation Common Stock,$2.4801,0.0101,0.409%,22952817.00,United States,,9426,Consumer Staples,Consumer Electronics/Appliances
KPLT,Katapult Holdings Inc. Common Stock,$12.00,0.00,0.00%,48782100.00,United States,2019,3259,Consumer Discretionary,Diversified Commercial Services
KPLTW,Katapult Holdings Inc. Warrant,$0.0288,-0.0011,-3.679%,117077.00,United States,2019,10559,Consumer Discretionary,Diversified Commercial Services
KPRX,Kiora Pharmaceuticals Inc.  Common Stock,$0.6061,0.0101,1.695%,15688344.00,United States,,78203,Health Care,Biotechnology: In Vitro & In Vivo Diagnostic Substances
KPTI,Karyopharm Therapeutics Inc. Common Stock,$1.40,0.03,2.19%,161093916.00,United States,2013,767585,Miscellaneous,Diversified Commercial Services
KR,Kroger Company (The) Common Stock,$56.83,0.35,0.62%,40884834493.00,United States,,3157164,Consumer Staples,Food Chains
KRC,Kilroy Realty Corporation Common Stock,$36.18,1.04,2.96%,4244869514.00,United States,1997,801996,Real Estate,Real Estate Investment Trusts
KREF,KKR Real Estate Finance Trust Inc. Common Stock,$10.12,0.25,2.533%,701456263.00,United States,2017,386685,Real Estate,Real Estate Investment Trusts
KREF^A,KKR Real Estate Finance Trust Inc. 6.50% Series A Cumulative Redeemable Preferred Stock,$18.68,-0.22,-1.164%,,United States,,28645,,
KRG,Kite Realty Group Trust Common Stock,$20.97,0.15,0.72%,4601833556.00,United States,2004,2360985,Real Estate,Real Estate Investment Trusts
KRKR,36Kr Holdings Inc. American Depositary Shares,$0.3915,0.0165,4.40%,15260176.00,China,2019,36487,Consumer Discretionary,Business Services
KRMD,KORU Medical Systems Inc. Common Stock (DE),$2.30,0.24,11.65%,105134150.00,United States,,108584,Health Care,Medical/Dental Instruments
KRNL,Kernel Group Holdings Inc. Class A Ordinary Shares,$10.94,0.00,0.00%,0.00,United States,2021,89,Finance,Blank Checks
KRNLW,Kernel Group Holdings Inc. Warrants,$0.0573,-0.0027,-4.50%,0.00,United States,2021,9000,Finance,Blank Checks
KRNT,Kornit Digital Ltd. Ordinary Shares,$17.85,0.40,2.292%,892500000.00,Israel,2015,534114,Industrials,Industrial Machinery/Components
KRNY,Kearny Financial Corp Common Stock,$6.20,0.33,5.622%,399509369.00,United States,2005,382858,Finance,Savings Institutions
KRO,Kronos Worldwide Inc Common Stock,$11.49,0.15,1.323%,1321660414.00,United States,,237712,Industrials,Major Chemicals
KRON,Kronos Bio Inc. Common Stock,$1.21,0.05,4.31%,70562989.00,United States,2020,129851,Health Care, Medicinal Chemicals and Botanical Products 
KROS,Keros Therapeutics Inc. Common Stock,$66.87,2.67,4.159%,2406158334.00,United States,2020,250552,Health Care,Biotechnology: Pharmaceutical Preparations
KRP,Kimbell Royalty Partners Common Units Representing Limited Partner Interests,$15.67,0.04,0.256%,1483929460.00,United States,2017,352765,Energy,Oil & Gas Production
KRRO,Korro Bio Inc. Common Stock,$64.74,0.59,0.92%,47812173.00,United States,2019,17733,Health Care,Biotechnology: Pharmaceutical Preparations
KRT,Karat Packaging Inc. Common Stock,$28.31,1.03,3.776%,565408169.00,United States,2021,58881,Industrials,Plastic Products
KRUS,Kura Sushi USA Inc. Class A Common Stock,$108.33,-1.76,-1.599%,1209304473.00,United States,2019,93510,Consumer Discretionary,Restaurants
KRYS,Krystal Biotech Inc. Common Stock,$171.33,4.33,2.593%,4847373899.00,United States,2017,219838,Health Care,Biotechnology: Biological Products (No Diagnostic Substances)
KSCP,Knightscope Inc. Class A Common Stock,$0.4446,-0.0104,-2.286%,42295994.00,United States,2022,693941,Telecommunications,Telecommunications Equipment
KSM,DWS Strategic Municipal Income Trust,$8.93,0.02,0.224%,0.00,United States,1989,22978,Finance,Trusts Except Educational Religious and Charitable
KSPI,Joint Stock Company Kaspi.kz American Depository Shares,$119.03,4.06,3.531%,22536362339.00,Kazakhstan,2024,239593,,
